{
  "artifact_id": "artifact_manifest_001",
  "kind": "ASSET_MANIFEST",
  "uri": "s3://dataforge/org_1/project_1/dataset_1/v1/manifest.jsonl",
  "hash": "sha256:aaaaaaaaaaaaaaaaaaaaaaaaaaaaaaaaaaaaaaaaaaaaaaaaaaaaaaaaaaaaaaaa",
  "media_type": "application/jsonl",
  "size_bytes": 2048,
  "schema_version": "local-fallback-v0.1.0-demo",
  "lineage": {
    "parent_version_id": "dataset_version_raw_001",
    "job_id": "job_manifest_001",
    "config_hash": "sha256:bbbbbbbbbbbbbbbbbbbbbbbbbbbbbbbbbbbbbbbbbbbbbbbbbbbbbbbbbbbbbbbb",
    "created_at": "2026-05-20T07:00:00Z"
  }
}
